"No.","Time","Source","Destination","Protocol","Length","Info"
"1","0.000000","192.168.18.21","192.168.18.49","SSH","178","Server: Encrypted packet (len=124)"
"2","0.055555","192.168.18.49","192.168.18.21","TCP","60","50637  >  22 [ACK] Seq=1 Ack=125 Win=252 Len=0"
"3","0.462857","192.168.18.21","192.168.18.49","SSH","146","Server: Encrypted packet (len=92)"
"4","0.518811","192.168.18.49","192.168.18.21","TCP","60","50641  >  22 [ACK] Seq=1 Ack=93 Win=255 Len=0"
"9","1.728326","192.168.18.21","192.168.18.49","SSH","146","Server: Encrypted packet (len=92)"
"10","1.776471","192.168.18.49","192.168.18.21","TCP","60","50641  >  22 [ACK] Seq=1 Ack=185 Win=254 Len=0"
"13","2.301485","195.128.248.23","192.168.18.221","TCP","409","82  >  49706 [PSH, ACK] Seq=1 Ack=1 Win=13 Len=355"
"14","2.342422","192.168.18.221","195.128.248.23","TCP","60","49706  >  82 [ACK] Seq=1 Ack=356 Win=510 Len=0"
"15","2.905933","192.168.18.21","192.168.18.49","SSH","146","Server: Encrypted packet (len=92)"
"16","2.959423","192.168.18.49","192.168.18.21","TCP","60","50641  >  22 [ACK] Seq=1 Ack=277 Win=254 Len=0"
"19","4.310193","192.168.18.21","192.168.18.49","SSH","146","Server: Encrypted packet (len=92)"
"20","4.363071","192.168.18.49","192.168.18.21","TCP","60","50641  >  22 [ACK] Seq=1 Ack=369 Win=254 Len=0"
"22","5.470397","192.168.18.21","192.168.18.49","SSH","146","Server: Encrypted packet (len=92)"
"23","5.520203","192.168.18.49","192.168.18.21","TCP","60","50641  >  22 [ACK] Seq=1 Ack=461 Win=253 Len=0"
"24","6.587963","192.168.18.21","192.168.18.49","SSH","146","Server: Encrypted packet (len=92)"
"25","6.588957","192.168.18.21","192.168.18.49","SSH","90","Server: Encrypted packet (len=36)"
"26","6.592118","192.168.18.49","192.168.18.21","TCP","60","50641  >  22 [ACK] Seq=1 Ack=589 Win=253 Len=0"
"28","7.721384","192.168.18.21","192.168.18.49","SSH","146","Server: Encrypted packet (len=92)"
"29","7.722402","192.168.18.21","192.168.18.49","SSH","90","Server: Encrypted packet (len=36)"
"30","7.727886","192.168.18.49","192.168.18.21","TCP","60","50641  >  22 [ACK] Seq=1 Ack=717 Win=252 Len=0"
"31","8.858171","192.168.18.21","192.168.18.49","SSH","146","Server: Encrypted packet (len=92)"
"32","8.909462","192.168.18.49","192.168.18.21","TCP","60","50641  >  22 [ACK] Seq=1 Ack=809 Win=252 Len=0"
"36","10.062301","192.168.18.21","192.168.18.49","SSH","146","Server: Encrypted packet (len=92)"
"37","10.109106","192.168.18.49","192.168.18.21","TCP","60","50641  >  22 [ACK] Seq=1 Ack=901 Win=252 Len=0"
"81","11.201004","192.168.18.21","192.168.18.49","SSH","146","Server: Encrypted packet (len=92)"
"82","11.256088","192.168.18.49","192.168.18.21","TCP","60","50641  >  22 [ACK] Seq=1 Ack=993 Win=251 Len=0"
"84","12.328307","192.168.18.21","192.168.18.49","SSH","146","Server: Encrypted packet (len=92)"
"85","12.380517","192.168.18.49","192.168.18.21","TCP","60","50641  >  22 [ACK] Seq=1 Ack=1085 Win=251 Len=0"
"87","13.465194","192.168.18.21","192.168.18.49","SSH","146","Server: Encrypted packet (len=92)"
"88","13.521857","192.168.18.49","192.168.18.21","TCP","60","50641  >  22 [ACK] Seq=1 Ack=1177 Win=251 Len=0"
"89","14.590118","192.168.18.21","192.168.18.49","SSH","146","Server: Encrypted packet (len=92)"
"90","14.640568","192.168.18.49","192.168.18.21","TCP","60","50641  >  22 [ACK] Seq=1 Ack=1269 Win=250 Len=0"
"95","15.722795","192.168.18.21","192.168.18.49","SSH","146","Server: Encrypted packet (len=92)"
"98","15.767947","192.168.18.49","192.168.18.21","TCP","60","50641  >  22 [ACK] Seq=1 Ack=1361 Win=250 Len=0"
"100","16.929480","192.168.18.21","192.168.18.49","SSH","146","Server: Encrypted packet (len=92)"
"101","16.975696","192.168.18.49","192.168.18.21","TCP","60","50641  >  22 [ACK] Seq=1 Ack=1453 Win=255 Len=0"
"104","18.053989","192.168.18.21","192.168.18.49","SSH","146","Server: Encrypted packet (len=92)"
"105","18.054795","192.168.18.21","192.168.18.49","SSH","90","Server: Encrypted packet (len=36)"
"106","18.058863","192.168.18.49","192.168.18.21","TCP","60","50641  >  22 [ACK] Seq=1 Ack=1581 Win=255 Len=0"
"109","19.187783","192.168.18.21","192.168.18.49","SSH","146","Server: Encrypted packet (len=92)"
"110","19.243147","192.168.18.49","192.168.18.21","TCP","60","50641  >  22 [ACK] Seq=1 Ack=1673 Win=255 Len=0"
"113","20.346731","192.168.18.21","192.168.18.49","SSH","146","Server: Encrypted packet (len=92)"
"114","20.403573","192.168.18.49","192.168.18.21","TCP","60","50641  >  22 [ACK] Seq=1 Ack=1765 Win=254 Len=0"
"116","21.460643","192.168.18.21","192.168.18.49","SSH","146","Server: Encrypted packet (len=92)"
"117","21.518504","192.168.18.49","192.168.18.21","TCP","60","50641  >  22 [ACK] Seq=1 Ack=1857 Win=254 Len=0"
"119","22.616786","192.168.18.21","192.168.18.49","SSH","146","Server: Encrypted packet (len=92)"
"120","22.617832","192.168.18.21","192.168.18.49","SSH","90","Server: Encrypted packet (len=36)"
"121","22.624389","192.168.18.49","192.168.18.21","TCP","60","50641  >  22 [ACK] Seq=1 Ack=1985 Win=253 Len=0"
"125","23.733436","192.168.18.21","192.168.18.49","SSH","146","Server: Encrypted packet (len=92)"
"126","23.734393","192.168.18.21","192.168.18.49","SSH","90","Server: Encrypted packet (len=36)"
"127","23.737204","192.168.18.49","192.168.18.21","TCP","60","50641  >  22 [ACK] Seq=1 Ack=2113 Win=253 Len=0"
"129","24.230055","2404:8000:1005:1a6e:7440:aac6:b318:f28d","2603:1061:13f0:6003::365:590","TLSv1.2","110","Application Data"
"130","24.290215","2603:1061:13f0:6003::365:590","2404:8000:1005:1a6e:7440:aac6:b318:f28d","TCP","74","443  >  50797 [ACK] Seq=1 Ack=37 Win=252 Len=0"
"131","24.345452","2603:1061:13f0:6003::365:590","2404:8000:1005:1a6e:7440:aac6:b318:f28d","TLSv1.2","106","Application Data"
"132","24.385691","2404:8000:1005:1a6e:7440:aac6:b318:f28d","2603:1061:13f0:6003::365:590","TCP","74","50797  >  443 [ACK] Seq=37 Ack=33 Win=513 Len=0"
"133","24.866493","192.168.18.21","192.168.18.49","SSH","146","Server: Encrypted packet (len=92)"
"134","24.868021","192.168.18.21","192.168.18.49","SSH","90","Server: Encrypted packet (len=36)"
"135","24.872269","192.168.18.49","192.168.18.21","TCP","60","50641  >  22 [ACK] Seq=1 Ack=2241 Win=252 Len=0"
"136","24.907719","31.13.95.61","192.168.18.221","TCP","93","5222  >  52333 [PSH, ACK] Seq=1 Ack=1 Win=546 Len=39"
"137","24.908484","192.168.18.221","31.13.95.61","TCP","83","52333  >  5222 [PSH, ACK] Seq=1 Ack=40 Win=511 Len=29"
"138","24.915353","31.13.95.61","192.168.18.221","TCP","60","5222  >  52333 [ACK] Seq=40 Ack=30 Win=546 Len=0"
"139","26.122956","192.168.18.21","192.168.18.49","SSH","146","Server: Encrypted packet (len=92)"
"140","26.124456","192.168.18.21","192.168.18.49","SSH","90","Server: Encrypted packet (len=36)"
"141","26.128635","192.168.18.49","192.168.18.21","TCP","60","50641  >  22 [ACK] Seq=1 Ack=2369 Win=252 Len=0"
"143","27.265550","192.168.18.21","192.168.18.49","SSH","146","Server: Encrypted packet (len=92)"
"144","27.322847","192.168.18.49","192.168.18.21","TCP","60","50641  >  22 [ACK] Seq=1 Ack=2461 Win=252 Len=0"
"145","28.742121","192.168.18.21","192.168.18.49","SSH","146","Server: Encrypted packet (len=92)"
"146","28.788975","192.168.18.49","192.168.18.21","TCP","60","50641  >  22 [ACK] Seq=1 Ack=2553 Win=251 Len=0"
"153","30.191717","192.168.18.21","192.168.18.49","SSH","146","Server: Encrypted packet (len=92)"
"154","30.243315","192.168.18.49","192.168.18.21","TCP","60","50641  >  22 [ACK] Seq=1 Ack=2645 Win=251 Len=0"
"158","31.324204","192.168.18.21","192.168.18.49","SSH","146","Server: Encrypted packet (len=92)"
"159","31.377506","192.168.18.49","192.168.18.21","TCP","60","50641  >  22 [ACK] Seq=1 Ack=2737 Win=250 Len=0"
"162","32.455104","192.168.18.21","192.168.18.49","SSH","146","Server: Encrypted packet (len=92)"
"163","32.507543","192.168.18.49","192.168.18.21","TCP","60","50641  >  22 [ACK] Seq=1 Ack=2829 Win=250 Len=0"
"165","32.950498","195.128.248.23","192.168.18.221","TCP","409","82  >  49706 [PSH, ACK] Seq=356 Ack=1 Win=13 Len=355"
"166","32.991321","192.168.18.221","195.128.248.23","TCP","60","49706  >  82 [ACK] Seq=1 Ack=711 Win=508 Len=0"
"167","33.581693","192.168.18.21","192.168.18.49","SSH","146","Server: Encrypted packet (len=92)"
"168","33.625778","192.168.18.49","192.168.18.21","TCP","60","50641  >  22 [ACK] Seq=1 Ack=2921 Win=255 Len=0"
"169","34.721684","192.168.18.21","192.168.18.49","SSH","146","Server: Encrypted packet (len=92)"
"170","34.777258","192.168.18.49","192.168.18.21","TCP","60","50641  >  22 [ACK] Seq=1 Ack=3013 Win=255 Len=0"
"171","35.856659","192.168.18.21","192.168.18.49","SSH","146","Server: Encrypted packet (len=92)"
"172","35.915942","192.168.18.49","192.168.18.21","TCP","60","50641  >  22 [ACK] Seq=1 Ack=3105 Win=255 Len=0"
"173","36.994623","192.168.18.21","192.168.18.49","SSH","146","Server: Encrypted packet (len=92)"
"174","37.044450","192.168.18.49","192.168.18.21","TCP","60","50641  >  22 [ACK] Seq=1 Ack=3197 Win=254 Len=0"
"175","38.244673","192.168.18.21","192.168.18.49","SSH","146","Server: Encrypted packet (len=92)"
"176","38.298103","192.168.18.49","192.168.18.21","TCP","60","50641  >  22 [ACK] Seq=1 Ack=3289 Win=254 Len=0"
"178","39.401915","192.168.18.21","192.168.18.49","SSH","146","Server: Encrypted packet (len=92)"
"179","39.445821","192.168.18.49","192.168.18.21","TCP","60","50641  >  22 [ACK] Seq=1 Ack=3381 Win=254 Len=0"
"182","40.963599","192.168.18.21","192.168.18.49","SSH","146","Server: Encrypted packet (len=92)"
"183","41.014054","192.168.18.49","192.168.18.21","TCP","60","50641  >  22 [ACK] Seq=1 Ack=3473 Win=253 Len=0"
"187","42.122631","192.168.18.21","192.168.18.49","SSH","146","Server: Encrypted packet (len=92)"
"188","42.172831","192.168.18.49","192.168.18.21","TCP","60","50641  >  22 [ACK] Seq=1 Ack=3565 Win=253 Len=0"
"189","42.459544","2404:8000:1005:1a6e:7440:aac6:b318:f28d","2603:1061:13f0:6003::365:590","TLSv1.2","110","Application Data"
"190","42.531453","2603:1061:13f0:6003::365:590","2404:8000:1005:1a6e:7440:aac6:b318:f28d","TCP","74","443  >  51094 [ACK] Seq=1 Ack=37 Win=254 Len=0"
"191","42.575726","2603:1061:13f0:6003::365:590","2404:8000:1005:1a6e:7440:aac6:b318:f28d","TLSv1.2","106","Application Data"
"192","42.616245","2404:8000:1005:1a6e:7440:aac6:b318:f28d","2603:1061:13f0:6003::365:590","TCP","74","51094  >  443 [ACK] Seq=37 Ack=33 Win=515 Len=0"
"193","43.241418","192.168.18.21","192.168.18.49","SSH","146","Server: Encrypted packet (len=92)"
"194","43.290298","192.168.18.49","192.168.18.21","TCP","60","50641  >  22 [ACK] Seq=1 Ack=3657 Win=253 Len=0"
"195","43.925245","192.168.18.24","192.168.18.21","TCP","74","56294  >  80 [SYN] Seq=0 Win=64240 Len=0 MSS=1460 SACK_PERM TSval=3500050482 TSecr=0 WS=128"
"197","43.928049","192.168.18.24","192.168.18.21","TCP","74","56306  >  80 [SYN] Seq=0 Win=64240 Len=0 MSS=1460 SACK_PERM TSval=3500050486 TSecr=0 WS=128"
"198","43.939684","192.168.18.24","192.168.18.21","TCP","74","56310  >  80 [SYN] Seq=0 Win=64240 Len=0 MSS=1460 SACK_PERM TSval=3500050497 TSecr=0 WS=128"
"199","43.947067","192.168.18.24","192.168.18.21","TCP","74","56316  >  80 [SYN] Seq=0 Win=64240 Len=0 MSS=1460 SACK_PERM TSval=3500050505 TSecr=0 WS=128"
"200","43.950434","192.168.18.24","192.168.18.21","TCP","74","56322  >  80 [SYN] Seq=0 Win=64240 Len=0 MSS=1460 SACK_PERM TSval=3500050508 TSecr=0 WS=128"
"201","43.953677","192.168.18.24","192.168.18.21","TCP","74","56328  >  80 [SYN] Seq=0 Win=64240 Len=0 MSS=1460 SACK_PERM TSval=3500050511 TSecr=0 WS=128"
"202","43.955657","192.168.18.24","192.168.18.21","TCP","74","56342  >  80 [SYN] Seq=0 Win=64240 Len=0 MSS=1460 SACK_PERM TSval=3500050513 TSecr=0 WS=128"
"203","43.959176","192.168.18.24","192.168.18.21","TCP","74","56352  >  80 [SYN] Seq=0 Win=64240 Len=0 MSS=1460 SACK_PERM TSval=3500050516 TSecr=0 WS=128"
"204","43.961371","192.168.18.24","192.168.18.21","TCP","74","56358  >  80 [SYN] Seq=0 Win=64240 Len=0 MSS=1460 SACK_PERM TSval=3500050519 TSecr=0 WS=128"
"205","43.964118","192.168.18.24","192.168.18.21","TCP","74","56368  >  80 [SYN] Seq=0 Win=64240 Len=0 MSS=1460 SACK_PERM TSval=3500050522 TSecr=0 WS=128"
"207","43.991037","192.168.18.21","192.168.18.24","TCP","74","80  >  56294 [SYN, ACK] Seq=0 Ack=1 Win=65160 Len=0 MSS=1460 SACK_PERM TSval=4274463031 TSecr=3500050482 WS=128"
"208","43.991263","192.168.18.21","192.168.18.24","TCP","74","80  >  56306 [SYN, ACK] Seq=0 Ack=1 Win=65160 Len=0 MSS=1460 SACK_PERM TSval=4274463034 TSecr=3500050486 WS=128"
"209","43.991421","192.168.18.21","192.168.18.24","TCP","74","80  >  56310 [SYN, ACK] Seq=0 Ack=1 Win=65160 Len=0 MSS=1460 SACK_PERM TSval=4274463045 TSecr=3500050497 WS=128"
"210","43.991573","192.168.18.21","192.168.18.24","TCP","74","80  >  56316 [SYN, ACK] Seq=0 Ack=1 Win=65160 Len=0 MSS=1460 SACK_PERM TSval=4274463053 TSecr=3500050505 WS=128"
"211","43.991766","192.168.18.21","192.168.18.24","TCP","74","80  >  56322 [SYN, ACK] Seq=0 Ack=1 Win=65160 Len=0 MSS=1460 SACK_PERM TSval=4274463056 TSecr=3500050508 WS=128"
"212","43.991919","192.168.18.21","192.168.18.24","TCP","74","80  >  56328 [SYN, ACK] Seq=0 Ack=1 Win=65160 Len=0 MSS=1460 SACK_PERM TSval=4274463059 TSecr=3500050511 WS=128"
"213","43.992098","192.168.18.21","192.168.18.24","TCP","74","80  >  56342 [SYN, ACK] Seq=0 Ack=1 Win=65160 Len=0 MSS=1460 SACK_PERM TSval=4274463061 TSecr=3500050513 WS=128"
"214","43.992293","192.168.18.21","192.168.18.24","TCP","74","80  >  56352 [SYN, ACK] Seq=0 Ack=1 Win=65160 Len=0 MSS=1460 SACK_PERM TSval=4274463065 TSecr=3500050516 WS=128"
"215","43.992441","192.168.18.21","192.168.18.24","TCP","74","80  >  56358 [SYN, ACK] Seq=0 Ack=1 Win=65160 Len=0 MSS=1460 SACK_PERM TSval=4274463067 TSecr=3500050519 WS=128"
"216","43.992660","192.168.18.21","192.168.18.24","TCP","74","80  >  56368 [SYN, ACK] Seq=0 Ack=1 Win=65160 Len=0 MSS=1460 SACK_PERM TSval=4274463070 TSecr=3500050522 WS=128"
"217","43.999662","192.168.18.24","192.168.18.21","TCP","66","56294  >  80 [ACK] Seq=1 Ack=1 Win=64256 Len=0 TSval=3500050552 TSecr=4274463031"
"218","43.999663","192.168.18.24","192.168.18.21","HTTP","459","GET /?SesMPAn=08qXTbojK7HoNQfo&Pg6ys=7y0l&KxgIjHibDE=lgbHML2E&8TQtut=yGMK6FGlKFDWj1Y HTTP/1.1 "
"219","43.999663","192.168.18.24","192.168.18.21","TCP","66","56306  >  80 [ACK] Seq=1 Ack=1 Win=64256 Len=0 TSval=3500050552 TSecr=4274463034"
"220","43.999663","192.168.18.24","192.168.18.21","TCP","74","56380  >  80 [SYN] Seq=0 Win=64240 Len=0 MSS=1460 SACK_PERM TSval=3500050553 TSecr=0 WS=128"
"221","43.999789","192.168.18.21","192.168.18.24","TCP","66","80  >  56294 [ACK] Seq=1 Ack=394 Win=64768 Len=0 TSval=4274463105 TSecr=3500050552"
"222","44.000143","192.168.18.21","192.168.18.24","TCP","74","80  >  56380 [SYN, ACK] Seq=0 Ack=1 Win=65160 Len=0 MSS=1460 SACK_PERM TSval=4274463106 TSecr=3500050553 WS=128"
"223","44.002191","192.168.18.24","192.168.18.21","HTTP","507","GET /?470ooqxsx=PLEP&uKbXBg=CvH&g5dXG=gnccQ1V1CJ2ARvpIj&iUDo=cwyst&p0GWncF=Wmqojhi6hp8Sr HTTP/1.1 "
"224","44.002191","192.168.18.24","192.168.18.21","TCP","66","56310  >  80 [ACK] Seq=1 Ack=1 Win=64256 Len=0 TSval=3500050553 TSecr=4274463045"
"225","44.002191","192.168.18.24","192.168.18.21","HTTP","502","GET /?pqIDIfxdw=xKc7X&O3U=JXpE1xUnxcfMF0 HTTP/1.1 "
"226","44.002191","192.168.18.24","192.168.18.21","TCP","74","56384  >  80 [SYN] Seq=0 Win=64240 Len=0 MSS=1460 SACK_PERM TSval=3500050554 TSecr=0 WS=128"
"227","44.002191","192.168.18.24","192.168.18.21","TCP","66","56316  >  80 [ACK] Seq=1 Ack=1 Win=64256 Len=0 TSval=3500050554 TSecr=4274463053"
"228","44.002191","192.168.18.24","192.168.18.21","TCP","66","56322  >  80 [ACK] Seq=1 Ack=1 Win=64256 Len=0 TSval=3500050555 TSecr=4274463056"
"229","44.002192","192.168.18.24","192.168.18.21","TCP","66","56328  >  80 [ACK] Seq=1 Ack=1 Win=64256 Len=0 TSval=3500050555 TSecr=4274463059"
"230","44.002192","192.168.18.24","192.168.18.21","HTTP","652","GET /?ObVX1=grNeb7LrYA7&71aIx6=LGConXHM3PfPfsevXn&bIgBKn2Ix=3qeME3hA3CuwWh8kiUJi HTTP/1.1 "
"231","44.002245","192.168.18.21","192.168.18.24","TCP","66","80  >  56306 [ACK] Seq=1 Ack=442 Win=64768 Len=0 TSval=4274463108 TSecr=3500050553"
"232","44.002616","192.168.18.21","192.168.18.24","TCP","66","80  >  56310 [ACK] Seq=1 Ack=437 Win=64768 Len=0 TSval=4274463108 TSecr=3500050554"
"233","44.002921","192.168.18.21","192.168.18.24","TCP","74","80  >  56384 [SYN, ACK] Seq=0 Ack=1 Win=65160 Len=0 MSS=1460 SACK_PERM TSval=4274463109 TSecr=3500050554 WS=128"
"234","44.003786","192.168.18.21","192.168.18.24","TCP","66","80  >  56316 [ACK] Seq=1 Ack=587 Win=64640 Len=0 TSval=4274463109 TSecr=3500050555"
"235","44.004214","192.168.18.24","192.168.18.21","TCP","74","56392  >  80 [SYN] Seq=0 Win=64240 Len=0 MSS=1460 SACK_PERM TSval=3500050555 TSecr=0 WS=128"
"236","44.004215","192.168.18.24","192.168.18.21","TCP","74","56394  >  80 [SYN] Seq=0 Win=64240 Len=0 MSS=1460 SACK_PERM TSval=3500050556 TSecr=0 WS=128"
"237","44.004215","192.168.18.24","192.168.18.21","HTTP","340","GET /?RW2=WF8P8m&c1H4=66dg6fW&qiaiK05Rmj=LHcjgj HTTP/1.1 "
"238","44.004215","192.168.18.24","192.168.18.21","TCP","74","56408  >  80 [SYN] Seq=0 Win=64240 Len=0 MSS=1460 SACK_PERM TSval=3500050556 TSecr=0 WS=128"
"239","44.004215","192.168.18.24","192.168.18.21","HTTP","505","GET /?ByrK05dbAA=wCP48MeianENhEni HTTP/1.1 "
"240","44.004215","192.168.18.24","192.168.18.21","TCP","74","56410  >  80 [SYN] Seq=0 Win=64240 Len=0 MSS=1460 SACK_PERM TSval=3500050557 TSecr=0 WS=128"
"241","44.004215","192.168.18.24","192.168.18.21","TCP","66","56342  >  80 [ACK] Seq=1 Ack=1 Win=64256 Len=0 TSval=3500050558 TSecr=4274463061"
"242","44.004215","192.168.18.24","192.168.18.21","TCP","66","56352  >  80 [ACK] Seq=1 Ack=1 Win=64256 Len=0 TSval=3500050558 TSecr=4274463065"
"243","44.004246","192.168.18.21","192.168.18.24","TCP","74","80  >  56392 [SYN, ACK] Seq=0 Ack=1 Win=65160 Len=0 MSS=1460 SACK_PERM TSval=4274463110 TSecr=3500050555 WS=128"
"244","44.004514","192.168.18.21","192.168.18.24","TCP","74","80  >  56394 [SYN, ACK] Seq=0 Ack=1 Win=65160 Len=0 MSS=1460 SACK_PERM TSval=4274463110 TSecr=3500050556 WS=128"
"245","44.004696","192.168.18.21","192.168.18.24","TCP","66","80  >  56322 [ACK] Seq=1 Ack=275 Win=64896 Len=0 TSval=4274463110 TSecr=3500050556"
"246","44.005077","192.168.18.21","192.168.18.24","TCP","74","80  >  56408 [SYN, ACK] Seq=0 Ack=1 Win=65160 Len=0 MSS=1460 SACK_PERM TSval=4274463111 TSecr=3500050556 WS=128"
"247","44.005323","192.168.18.21","192.168.18.24","TCP","66","80  >  56328 [ACK] Seq=1 Ack=440 Win=64768 Len=0 TSval=4274463111 TSecr=3500050557"
"248","44.005543","192.168.18.21","192.168.18.24","TCP","74","80  >  56410 [SYN, ACK] Seq=0 Ack=1 Win=65160 Len=0 MSS=1460 SACK_PERM TSval=4274463111 TSecr=3500050557 WS=128"
"249","44.005855","192.168.18.24","192.168.18.21","TCP","66","56358  >  80 [ACK] Seq=1 Ack=1 Win=64256 Len=0 TSval=3500050558 TSecr=4274463067"
"250","44.005855","192.168.18.24","192.168.18.21","TCP","66","56368  >  80 [ACK] Seq=1 Ack=1 Win=64256 Len=0 TSval=3500050558 TSecr=4274463070"
"251","44.005855","192.168.18.24","192.168.18.21","HTTP","737","GET /?uKo=R6T5o5gWU&PXPkVA=Ai2Kx0ufS1&175Le=HucJSSi6pGQ&5sK3MWaY=WDq1Ubm3S3E5diBUrfgK&DBa=vMwWNlR8dbAL75qNCI80 HTTP/1.1 "
"252","44.005855","192.168.18.24","192.168.18.21","HTTP","696","GET /?f1FW=MewKUIHV5AjO7bCbaL&3gCbksS=tXxRdHc0Fbmc7JxDhth&OrHn=ky0U8gNkGm&cqb6eQ=8RSEf&ylRnPu1=NonKQBrY6Ko HTTP/1.1 "
"253","44.005855","192.168.18.24","192.168.18.21","TCP","74","56420  >  80 [SYN] Seq=0 Win=64240 Len=0 MSS=1460 SACK_PERM TSval=3500050558 TSecr=0 WS=128"
"254","44.005855","192.168.18.24","192.168.18.21","HTTP","695","GET /?H3QSEbYRGh=gQmi7YPRlS6Ldty8wdL&f1sLqtPHil=Co7FPAxdAuxdpVxv&exqFg=6FV261CRBn&NjeNaiDSva=dhGY HTTP/1.1 "
"255","44.005855","192.168.18.24","192.168.18.21","TCP","74","56428  >  80 [SYN] Seq=0 Win=64240 Len=0 MSS=1460 SACK_PERM TSval=3500050559 TSecr=0 WS=128"
"256","44.005855","192.168.18.24","192.168.18.21","HTTP","525","GET /?mPwFFbPUl8=OWA3G&mXDUV=DtU&88T=CbA2qV1JCq8 HTTP/1.1 "
"257","44.005897","192.168.18.21","192.168.18.24","TCP","66","80  >  56352 [ACK] Seq=1 Ack=672 Win=64512 Len=0 TSval=4274463112 TSecr=3500050558"
"258","44.006152","192.168.18.21","192.168.18.24","TCP","66","80  >  56368 [ACK] Seq=1 Ack=631 Win=64640 Len=0 TSval=4274463112 TSecr=3500050558"
"259","44.006359","192.168.18.21","192.168.18.24","TCP","74","80  >  56420 [SYN, ACK] Seq=0 Ack=1 Win=65160 Len=0 MSS=1460 SACK_PERM TSval=4274463112 TSecr=3500050558 WS=128"
"260","44.006622","192.168.18.21","192.168.18.24","TCP","2962","80  >  56306 [PSH, ACK] Seq=1 Ack=442 Win=64768 Len=2896 TSval=4274463112 TSecr=3500050553 [TCP PDU reassembled in 284]"
"261","44.006905","192.168.18.21","192.168.18.24","TCP","2962","80  >  56306 [PSH, ACK] Seq=2897 Ack=442 Win=64768 Len=2896 TSval=4274463112 TSecr=3500050553 [TCP PDU reassembled in 284]"
"262","44.008241","192.168.18.24","192.168.18.21","TCP","74","56434  >  80 [SYN] Seq=0 Win=64240 Len=0 MSS=1460 SACK_PERM TSval=3500050559 TSecr=0 WS=128"
"263","44.008241","192.168.18.24","192.168.18.21","TCP","74","56442  >  80 [SYN] Seq=0 Win=64240 Len=0 MSS=1460 SACK_PERM TSval=3500050560 TSecr=0 WS=128"
"264","44.008241","192.168.18.24","192.168.18.21","TCP","66","56380  >  80 [ACK] Seq=1 Ack=1 Win=64256 Len=0 TSval=3500050562 TSecr=4274463106"
"265","44.008242","192.168.18.24","192.168.18.21","HTTP","731","GET /?PoWr6rV=S7jJ&W3OySIjb8=scnQyENYS3PbAwX&jnK=8n34&aPPAPxNBpM=gy0qL&rjMjeQ5Vvp=C6PiovEurnwb HTTP/1.1 "
"266","44.008242","192.168.18.24","192.168.18.21","TCP","74","56452  >  80 [SYN] Seq=0 Win=64240 Len=0 MSS=1460 SACK_PERM TSval=3500050562 TSecr=0 WS=128"
"267","44.009275","192.168.18.21","192.168.18.24","TCP","2962","80  >  56294 [PSH, ACK] Seq=1 Ack=394 Win=64768 Len=2896 TSval=4274463112 TSecr=3500050552 [TCP PDU reassembled in 323]"
"268","44.009312","192.168.18.21","192.168.18.24","TCP","2962","80  >  56316 [PSH, ACK] Seq=1 Ack=587 Win=64640 Len=2896 TSval=4274463113 TSecr=3500050555 [TCP PDU reassembled in 321]"
"269","44.009315","192.168.18.21","192.168.18.24","TCP","2962","80  >  56322 [PSH, ACK] Seq=1 Ack=275 Win=64896 Len=2896 TSval=4274463113 TSecr=3500050556 [TCP PDU reassembled in 319]"
"270","44.009318","192.168.18.21","192.168.18.24","TCP","66","80  >  56342 [ACK] Seq=1 Ack=630 Win=64640 Len=0 TSval=4274463114 TSecr=3500050559"
"271","44.009320","192.168.18.21","192.168.18.24","TCP","2962","80  >  56310 [PSH, ACK] Seq=1 Ack=437 Win=64768 Len=2896 TSval=4274463114 TSecr=3500050554 [TCP PDU reassembled in 317]"
"272","44.010354","192.168.18.24","192.168.18.21","TCP","66","56384  >  80 [ACK] Seq=1 Ack=1 Win=64256 Len=0 TSval=3500050565 TSecr=4274463109"
"273","44.010608","192.168.18.21","192.168.18.24","TCP","74","80  >  56428 [SYN, ACK] Seq=0 Ack=1 Win=65160 Len=0 MSS=1460 SACK_PERM TSval=4274463114 TSecr=3500050559 WS=128"
"274","44.010615","192.168.18.21","192.168.18.24","TCP","66","80  >  56358 [ACK] Seq=1 Ack=460 Win=64768 Len=0 TSval=4274463114 TSecr=3500050559"
"275","44.010616","192.168.18.21","192.168.18.24","TCP","74","80  >  56434 [SYN, ACK] Seq=0 Ack=1 Win=65160 Len=0 MSS=1460 SACK_PERM TSval=4274463114 TSecr=3500050559 WS=128"
"276","44.010617","192.168.18.21","192.168.18.24","TCP","74","80  >  56442 [SYN, ACK] Seq=0 Ack=1 Win=65160 Len=0 MSS=1460 SACK_PERM TSval=4274463114 TSecr=3500050560 WS=128"
"277","44.010618","192.168.18.21","192.168.18.24","TCP","66","80  >  56380 [ACK] Seq=1 Ack=666 Win=64512 Len=0 TSval=4274463114 TSecr=3500050562"
"278","44.010619","192.168.18.21","192.168.18.24","TCP","74","80  >  56452 [SYN, ACK] Seq=0 Ack=1 Win=65160 Len=0 MSS=1460 SACK_PERM TSval=4274463114 TSecr=3500050562 WS=128"
"279","44.010620","192.168.18.21","192.168.18.24","TCP","2962","80  >  56306 [PSH, ACK] Seq=5793 Ack=442 Win=64768 Len=2896 TSval=4274463116 TSecr=3500050553 [TCP PDU reassembled in 284]"
"280","44.010624","192.168.18.21","192.168.18.24","TCP","2962","80  >  56294 [PSH, ACK] Seq=2897 Ack=394 Win=64768 Len=2896 TSval=4274463112 TSecr=3500050552 [TCP PDU reassembled in 323]"
"281","44.010626","192.168.18.21","192.168.18.24","TCP","2962","80  >  56316 [PSH, ACK] Seq=2897 Ack=587 Win=64640 Len=2896 TSval=4274463113 TSecr=3500050555 [TCP PDU reassembled in 321]"
"282","44.010629","192.168.18.21","192.168.18.24","TCP","2962","80  >  56322 [PSH, ACK] Seq=2897 Ack=275 Win=64896 Len=2896 TSval=4274463113 TSecr=3500050556 [TCP PDU reassembled in 319]"
"283","44.010632","192.168.18.21","192.168.18.24","TCP","2962","80  >  56310 [PSH, ACK] Seq=2897 Ack=437 Win=64768 Len=2896 TSval=4274463114 TSecr=3500050554 [TCP PDU reassembled in 317]"
"284","44.010635","192.168.18.21","192.168.18.24","HTTP","2360","HTTP/1.1 200 OK  (text/html)"
"285","44.013127","192.168.18.24","192.168.18.21","HTTP","461","GET /?nlUdO=loGKtcJYG6H&rumk=Th6bs2tk1yg HTTP/1.1 "
"286","44.013127","192.168.18.24","192.168.18.21","TCP","74","56464  >  80 [SYN] Seq=0 Win=64240 Len=0 MSS=1460 SACK_PERM TSval=3500050565 TSecr=0 WS=128"
"287","44.013127","192.168.18.24","192.168.18.21","TCP","66","56392  >  80 [ACK] Seq=1 Ack=1 Win=64256 Len=0 TSval=3500050568 TSecr=4274463110"
"288","44.013127","192.168.18.24","192.168.18.21","HTTP","396","GET /?Y8gafNC=Bl0ePdDjXg HTTP/1.1 "
"289","44.013127","192.168.18.24","192.168.18.21","TCP","66","56394  >  80 [ACK] Seq=1 Ack=1 Win=64256 Len=0 TSval=3500050569 TSecr=4274463110"
"290","44.013127","192.168.18.24","192.168.18.21","TCP","66","56408  >  80 [ACK] Seq=1 Ack=1 Win=64256 Len=0 TSval=3500050569 TSecr=4274463111"
"291","44.013127","192.168.18.24","192.168.18.21","TCP","66","56410  >  80 [ACK] Seq=1 Ack=1 Win=64256 Len=0 TSval=3500050569 TSecr=4274463111"
"292","44.013127","192.168.18.24","192.168.18.21","TCP","66","56420  >  80 [ACK] Seq=1 Ack=1 Win=64256 Len=0 TSval=3500050569 TSecr=4274463112"
"293","44.013174","192.168.18.21","192.168.18.24","TCP","66","80  >  56384 [ACK] Seq=1 Ack=396 Win=64768 Len=0 TSval=4274463119 TSecr=3500050565"
"294","44.013374","192.168.18.21","192.168.18.24","TCP","74","80  >  56464 [SYN, ACK] Seq=0 Ack=1 Win=65160 Len=0 MSS=1460 SACK_PERM TSval=4274463119 TSecr=3500050565 WS=128"
"295","44.013607","192.168.18.21","192.168.18.24","TCP","66","80  >  56392 [ACK] Seq=1 Ack=331 Win=64896 Len=0 TSval=4274463119 TSecr=3500050569"
"296","44.013778","192.168.18.24","192.168.18.21","TCP","66","56306  >  80 [ACK] Seq=442 Ack=2897 Win=70144 Len=0 TSval=3500050569 TSecr=4274463112"
"297","44.013778","192.168.18.24","192.168.18.21","TCP","66","56306  >  80 [ACK] Seq=442 Ack=5793 Win=75904 Len=0 TSval=3500050569 TSecr=4274463112"
"298","44.013778","192.168.18.24","192.168.18.21","TCP","74","56476  >  80 [SYN] Seq=0 Win=64240 Len=0 MSS=1460 SACK_PERM TSval=3500050569 TSecr=0 WS=128"
"299","44.013778","192.168.18.24","192.168.18.21","HTTP","402","GET /?N2N=6Caa HTTP/1.1 "
"300","44.013778","192.168.18.24","192.168.18.21","TCP","74","56490  >  80 [SYN] Seq=0 Win=64240 Len=0 MSS=1460 SACK_PERM TSval=3500050570 TSecr=0 WS=128"
"301","44.013778","192.168.18.24","192.168.18.21","HTTP","429","GET /?ywP2=e1XjcDy0lpH&sGd2WH=8Pc5sSrpfr107QE2mJ3v HTTP/1.1 "
"302","44.013778","192.168.18.24","192.168.18.21","TCP","74","56504  >  80 [SYN] Seq=0 Win=64240 Len=0 MSS=1460 SACK_PERM TSval=3500050570 TSecr=0 WS=128"
"303","44.013778","192.168.18.24","192.168.18.21","HTTP","342","GET /?MmU3R3uJh=S87hnSxDla&VI60bQi8ic=IicooX&IVRM=cYSs HTTP/1.1 "
"304","44.013815","192.168.18.21","192.168.18.24","TCP","74","80  >  56476 [SYN, ACK] Seq=0 Ack=1 Win=65160 Len=0 MSS=1460 SACK_PERM TSval=4274463119 TSecr=3500050569 WS=128"
"305","44.013986","192.168.18.21","192.168.18.24","TCP","66","80  >  56410 [ACK] Seq=1 Ack=337 Win=64896 Len=0 TSval=4274463120 TSecr=3500050569"
"306","44.014153","192.168.18.21","192.168.18.24","TCP","74","80  >  56490 [SYN, ACK] Seq=0 Ack=1 Win=65160 Len=0 MSS=1460 SACK_PERM TSval=4274463120 TSecr=3500050570 WS=128"
"307","44.014361","192.168.18.21","192.168.18.24","TCP","66","80  >  56420 [ACK] Seq=1 Ack=364 Win=64896 Len=0 TSval=4274463120 TSecr=3500050570"
"308","44.014568","192.168.18.21","192.168.18.24","TCP","74","80  >  56504 [SYN, ACK] Seq=0 Ack=1 Win=65160 Len=0 MSS=1460 SACK_PERM TSval=4274463120 TSecr=3500050570 WS=128"
"309","44.014738","192.168.18.21","192.168.18.24","TCP","66","80  >  56394 [ACK] Seq=1 Ack=277 Win=64896 Len=0 TSval=4274463120 TSecr=3500050570"
"310","44.015679","192.168.18.24","192.168.18.21","HTTP","494","GET /?cdkwGrJ=tvGrFy81N0BDyJv&QBq=7YFaM1423GDG2EwRL&AEnAT=o1aJl6v5WWI8 HTTP/1.1 "
"311","44.015679","192.168.18.24","192.168.18.21","TCP","74","56518  >  80 [SYN] Seq=0 Win=64240 Len=0 MSS=1460 SACK_PERM TSval=3500050571 TSecr=0 WS=128"
"312","44.015679","192.168.18.24","192.168.18.21","TCP","74","56522  >  80 [SYN] Seq=0 Win=64240 Len=0 MSS=1460 SACK_PERM TSval=3500050571 TSecr=0 WS=128"
"313","44.015714","192.168.18.21","192.168.18.24","TCP","66","80  >  56408 [ACK] Seq=1 Ack=429 Win=64768 Len=0 TSval=4274463121 TSecr=3500050570"
"314","44.015889","192.168.18.21","192.168.18.24","TCP","74","80  >  56518 [SYN, ACK] Seq=0 Ack=1 Win=65160 Len=0 MSS=1460 SACK_PERM TSval=4274463122 TSecr=3500050571 WS=128"
"315","44.016053","192.168.18.21","192.168.18.24","TCP","74","80  >  56522 [SYN, ACK] Seq=0 Ack=1 Win=65160 Len=0 MSS=1460 SACK_PERM TSval=4274463122 TSecr=3500050571 WS=128"
"316","44.017046","192.168.18.21","192.168.18.24","TCP","2962","80  >  56310 [PSH, ACK] Seq=5793 Ack=437 Win=64768 Len=2896 TSval=4274463123 TSecr=3500050554 [TCP PDU reassembled in 317]"
"317","44.017271","192.168.18.21","192.168.18.24","HTTP","2360","HTTP/1.1 200 OK  (text/html)"
"318","44.017449","192.168.18.21","192.168.18.24","TCP","2962","80  >  56322 [PSH, ACK] Seq=5793 Ack=275 Win=64896 Len=2896 TSval=4274463123 TSecr=3500050556 [TCP PDU reassembled in 319]"
"319","44.017687","192.168.18.21","192.168.18.24","HTTP","2360","HTTP/1.1 200 OK  (text/html)"
"320","44.017980","192.168.18.21","192.168.18.24","TCP","2962","80  >  56316 [PSH, ACK] Seq=5793 Ack=587 Win=64640 Len=2896 TSval=4274463124 TSecr=3500050555 [TCP PDU reassembled in 321]"
"321","44.018569","192.168.18.21","192.168.18.24","HTTP","2360","HTTP/1.1 200 OK  (text/html)"
"322","44.018769","192.168.18.21","192.168.18.24","TCP","2962","80  >  56294 [PSH, ACK] Seq=5793 Ack=394 Win=64768 Len=2896 TSval=4274463124 TSecr=3500050552 [TCP PDU reassembled in 323]"
"323","44.018946","192.168.18.21","192.168.18.24","HTTP","2360","HTTP/1.1 200 OK  (text/html)"
"324","44.019624","192.168.18.24","192.168.18.21","TCP","66","56294  >  80 [ACK] Seq=394 Ack=2897 Win=70144 Len=0 TSval=3500050574 TSecr=4274463112"
"325","44.019624","192.168.18.24","192.168.18.21","TCP","66","56316  >  80 [ACK] Seq=587 Ack=2897 Win=70144 Len=0 TSval=3500050574 TSecr=4274463113"
"326","44.019624","192.168.18.24","192.168.18.21","TCP","66","56322  >  80 [ACK] Seq=275 Ack=2897 Win=70144 Len=0 TSval=3500050574 TSecr=4274463113"
"327","44.019624","192.168.18.24","192.168.18.21","TCP","66","56310  >  80 [ACK] Seq=437 Ack=2897 Win=70144 Len=0 TSval=3500050574 TSecr=4274463114"
"328","44.019624","192.168.18.24","192.168.18.21","TCP","66","56428  >  80 [ACK] Seq=1 Ack=1 Win=64256 Len=0 TSval=3500050575 TSecr=4274463114"
"329","44.019624","192.168.18.24","192.168.18.21","TCP","66","56434  >  80 [ACK] Seq=1 Ack=1 Win=64256 Len=0 TSval=3500050575 TSecr=4274463114"
"330","44.019624","192.168.18.24","192.168.18.21","TCP","66","56442  >  80 [ACK] Seq=1 Ack=1 Win=64256 Len=0 TSval=3500050575 TSecr=4274463114"
"331","44.020720","192.168.18.24","192.168.18.21","HTTP","394","GET /?MdT5SV6NPQ=T7dpp7RMX1iJLdn4H&NhJKD=lKHox1oqspuRdhbuf&G61Ihfi=rafDB&sXE1r=uwWbr HTTP/1.1 "
"332","44.020720","192.168.18.24","192.168.18.21","TCP","66","56452  >  80 [ACK] Seq=1 Ack=1 Win=64256 Len=0 TSval=3500050575 TSecr=4274463114"
"333","44.020720","192.168.18.24","192.168.18.21","TCP","66","56306  >  80 [ACK] Seq=442 Ack=8689 Win=81664 Len=0 TSval=3500050575 TSecr=4274463116"
"334","44.020720","192.168.18.24","192.168.18.21","TCP","66","56294  >  80 [ACK] Seq=394 Ack=5793 Win=75904 Len=0 TSval=3500050575 TSecr=4274463112"
"335","44.020720","192.168.18.24","192.168.18.21","TCP","66","56316  >  80 [ACK] Seq=587 Ack=5793 Win=75904 Len=0 TSval=3500050575 TSecr=4274463113"
"336","44.020720","192.168.18.24","192.168.18.21","TCP","66","56322  >  80 [ACK] Seq=275 Ack=5793 Win=75904 Len=0 TSval=3500050575 TSecr=4274463113"
"337","44.020720","192.168.18.24","192.168.18.21","TCP","66","56310  >  80 [ACK] Seq=437 Ack=5793 Win=75904 Len=0 TSval=3500050575 TSecr=4274463114"
"338","44.020721","192.168.18.24","192.168.18.21","TCP","66","56306  >  80 [ACK] Seq=442 Ack=10983 Win=81664 Len=0 TSval=3500050575 TSecr=4274463116"
"339","44.020798","192.168.18.21","192.168.18.24","TCP","66","80  >  56428 [ACK] Seq=1 Ack=329 Win=64896 Len=0 TSval=4274463126 TSecr=3500050575"
"340","44.021916","192.168.18.24","192.168.18.21","HTTP","348","GET /?5Abw=Rxl30WoYLBCgjDA7NLE HTTP/1.1 "
"341","44.021917","192.168.18.24","192.168.18.21","TCP","74","56528  >  80 [SYN] Seq=0 Win=64240 Len=0 MSS=1460 SACK_PERM TSval=3500050575 TSecr=0 WS=128"
"342","44.021917","192.168.18.24","192.168.18.21","HTTP","561","GET /?d2UB=wxXXXcqKRxVWf&uhkaq31w0=lQhgwnnCcqC2x418VC&dpt4v=dSf5X&kbU=mTT2 HTTP/1.1 "
"343","44.021917","192.168.18.24","192.168.18.21","TCP","74","56534  >  80 [SYN] Seq=0 Win=64240 Len=0 MSS=1460 SACK_PERM TSval=3500050576 TSecr=0 WS=128"
"344","44.021917","192.168.18.24","192.168.18.21","HTTP","366","GET /?FYIIffo1w=HUY3V&YJv3qs=hsTbHQ&wF8rm0Pr=SpniI HTTP/1.1 "
"345","44.021917","192.168.18.24","192.168.18.21","TCP","74","56548  >  80 [SYN] Seq=0 Win=64240 Len=0 MSS=1460 SACK_PERM TSval=3500050576 TSecr=0 WS=128"
"346","44.021917","192.168.18.24","192.168.18.21","TCP","74","56564  >  80 [SYN] Seq=0 Win=64240 Len=0 MSS=1460 SACK_PERM TSval=3500050576 TSecr=0 WS=128"
"347","44.021955","192.168.18.21","192.168.18.24","TCP","66","80  >  56442 [ACK] Seq=1 Ack=283 Win=64896 Len=0 TSval=4274463128 TSecr=3500050575"
"348","44.022131","192.168.18.21","192.168.18.24","TCP","74","80  >  56528 [SYN, ACK] Seq=0 Ack=1 Win=65160 Len=0 MSS=1460 SACK_PERM TSval=4274463128 TSecr=3500050575 WS=128"
"349","44.022306","192.168.18.21","192.168.18.24","TCP","66","80  >  56434 [ACK] Seq=1 Ack=496 Win=64768 Len=0 TSval=4274463128 TSecr=3500050575"
"350","44.022473","192.168.18.21","192.168.18.24","TCP","74","80  >  56534 [SYN, ACK] Seq=0 Ack=1 Win=65160 Len=0 MSS=1460 SACK_PERM TSval=4274463128 TSecr=3500050576 WS=128"
"351","44.022673","192.168.18.21","192.168.18.24","TCP","66","80  >  56452 [ACK] Seq=1 Ack=301 Win=64896 Len=0 TSval=4274463128 TSecr=3500050576"
"352","44.022841","192.168.18.21","192.168.18.24","TCP","74","80  >  56548 [SYN, ACK] Seq=0 Ack=1 Win=65160 Len=0 MSS=1460 SACK_PERM TSval=4274463128 TSecr=3500050576 WS=128"
"353","44.023006","192.168.18.21","192.168.18.24","TCP","74","80  >  56564 [SYN, ACK] Seq=0 Ack=1 Win=65160 Len=0 MSS=1460 SACK_PERM TSval=4274463129 TSecr=3500050576 WS=128"
"354","44.024535","192.168.18.24","192.168.18.21","TCP","66","56464  >  80 [ACK] Seq=1 Ack=1 Win=64256 Len=0 TSval=3500050581 TSecr=4274463119"
"355","44.026026","192.168.18.24","192.168.18.21","TCP","66","56476  >  80 [ACK] Seq=1 Ack=1 Win=64256 Len=0 TSval=3500050581 TSecr=4274463119"
"356","44.026027","192.168.18.24","192.168.18.21","TCP","66","56490  >  80 [ACK] Seq=1 Ack=1 Win=64256 Len=0 TSval=3500050581 TSecr=4274463120"
"357","44.026027","192.168.18.24","192.168.18.21","TCP","66","56504  >  80 [ACK] Seq=1 Ack=1 Win=64256 Len=0 TSval=3500050581 TSecr=4274463120"
"358","44.026027","192.168.18.24","192.168.18.21","TCP","66","56518  >  80 [ACK] Seq=1 Ack=1 Win=64256 Len=0 TSval=3500050581 TSecr=4274463122"
"359","44.026027","192.168.18.24","192.168.18.21","HTTP","467","GET /?aXEGtNpL=VIuSg8Kt4t2WGGV&caWRN4CpW=vBtLTG4&DpwnG6uw=b1Mr2DO HTTP/1.1 "
"360","44.026027","192.168.18.24","192.168.18.21","TCP","74","56574  >  80 [SYN] Seq=0 Win=64240 Len=0 MSS=1460 SACK_PERM TSval=3500050582 TSecr=0 WS=128"
"361","44.026081","192.168.18.21","192.168.18.24","TCP","66","80  >  56504 [ACK] Seq=1 Ack=402 Win=64768 Len=0 TSval=4274463132 TSecr=3500050581"
"362","44.026303","192.168.18.21","192.168.18.24","TCP","74","80  >  56574 [SYN, ACK] Seq=0 Ack=1 Win=65160 Len=0 MSS=1460 SACK_PERM TSval=4274463132 TSecr=3500050582 WS=128"
"363","44.027325","192.168.18.24","192.168.18.21","HTTP","699","GET /?RPfa=DyIfApI7&lbngq2Bp=EbtFk HTTP/1.1 "
"364","44.027325","192.168.18.24","192.168.18.21","TCP","66","56522  >  80 [ACK] Seq=1 Ack=1 Win=64256 Len=0 TSval=3500050582 TSecr=4274463122"
"365","44.027325","192.168.18.24","192.168.18.21","TCP","66","56310  >  80 [ACK] Seq=437 Ack=8689 Win=81664 Len=0 TSval=3500050582 TSecr=4274463123"
"366","44.027325","192.168.18.24","192.168.18.21","TCP","66","56310  >  80 [ACK] Seq=437 Ack=10983 Win=81664 Len=0 TSval=3500050582 TSecr=4274463123"
"367","44.027325","192.168.18.24","192.168.18.21","TCP","74","56580  >  80 [SYN] Seq=0 Win=64240 Len=0 MSS=1460 SACK_PERM TSval=3500050582 TSecr=0 WS=128"
"368","44.027325","192.168.18.24","192.168.18.21","HTTP","530","GET /?vTJS=NkPMPoRR2oo&PqLbSo=nRLfNIjURc4qf0H8Vs&WGKRsyNfv=2qqE&yc6P=ofjGMUt3tA8iRCi&8QEMh6aAnr=EhxXCJJSRKqlfyF0WUvJ HTTP/1.1 "
"369","44.027325","192.168.18.24","192.168.18.21","TCP","66","56322  >  80 [ACK] Seq=275 Ack=8689 Win=81664 Len=0 TSval=3500050582 TSecr=4274463123"
"370","44.027325","192.168.18.24","192.168.18.21","TCP","66","56322  >  80 [ACK] Seq=275 Ack=10983 Win=81664 Len=0 TSval=3500050582 TSecr=4274463123"
"371","44.027362","192.168.18.21","192.168.18.24","TCP","66","80  >  56464 [ACK] Seq=1 Ack=634 Win=64640 Len=0 TSval=4274463133 TSecr=3500050582"
"372","44.027625","192.168.18.21","192.168.18.24","TCP","74","80  >  56580 [SYN, ACK] Seq=0 Ack=1 Win=65160 Len=0 MSS=1460 SACK_PERM TSval=4274463133 TSecr=3500050582 WS=128"
"373","44.027808","192.168.18.21","192.168.18.24","TCP","66","80  >  56476 [ACK] Seq=1 Ack=465 Win=64768 Len=0 TSval=4274463133 TSecr=3500050582"
"374","44.027983","192.168.18.24","192.168.18.21","TCP","74","56594  >  80 [SYN] Seq=0 Win=64240 Len=0 MSS=1460 SACK_PERM TSval=3500050582 TSecr=0 WS=128"
"375","44.027983","192.168.18.24","192.168.18.21","HTTP","550","GET /?vQpxydR=78E7KoTXnrqogCjQ&P7gP=5uVOKGGYD&FsIANBh=1RO&ABCi=w3kq375d&pltKA8=aOj HTTP/1.1 "
"376","44.027983","192.168.18.24","192.168.18.21","TCP","66","56316  >  80 [ACK] Seq=587 Ack=8689 Win=81664 Len=0 TSval=3500050583 TSecr=4274463124"
"377","44.027983","192.168.18.24","192.168.18.21","TCP","74","56610  >  80 [SYN] Seq=0 Win=64240 Len=0 MSS=1460 SACK_PERM TSval=3500050583 TSecr=0 WS=128"
"378","44.027983","192.168.18.24","192.168.18.21","HTTP","564","GET /?NLwcWcSFKB=neuttLnldsOM&Aet8HVUq=EPG HTTP/1.1 "
"379","44.027983","192.168.18.24","192.168.18.21","TCP","66","56316  >  80 [ACK] Seq=587 Ack=10983 Win=81664 Len=0 TSval=3500050583 TSecr=4274463124"
"380","44.027983","192.168.18.24","192.168.18.21","TCP","66","56294  >  80 [ACK] Seq=394 Ack=8689 Win=81664 Len=0 TSval=3500050583 TSecr=4274463124"
"381","44.027983","192.168.18.24","192.168.18.21","TCP","66","56294  >  80 [ACK] Seq=394 Ack=10983 Win=81664 Len=0 TSval=3500050583 TSecr=4274463124"
"382","44.028006","192.168.18.21","192.168.18.24","TCP","74","80  >  56594 [SYN, ACK] Seq=0 Ack=1 Win=65160 Len=0 MSS=1460 SACK_PERM TSval=4274463134 TSecr=3500050582 WS=128"
"383","44.028219","192.168.18.21","192.168.18.24","TCP","66","80  >  56490 [ACK] Seq=1 Ack=485 Win=64768 Len=0 TSval=4274463134 TSecr=3500050582"
"384","44.028405","192.168.18.21","192.168.18.24","TCP","74","80  >  56610 [SYN, ACK] Seq=0 Ack=1 Win=65160 Len=0 MSS=1460 SACK_PERM TSval=4274463134 TSecr=3500050583 WS=128"
"385","44.028592","192.168.18.21","192.168.18.24","TCP","66","80  >  56522 [ACK] Seq=1 Ack=499 Win=64768 Len=0 TSval=4274463134 TSecr=3500050583"
"386","44.028944","192.168.18.24","192.168.18.21","TCP","74","56626  >  80 [SYN] Seq=0 Win=64240 Len=0 MSS=1460 SACK_PERM TSval=3500050583 TSecr=0 WS=128"
"387","44.028944","192.168.18.24","192.168.18.21","HTTP","700","GET /?jinW=cPbGgcPgY&oSPU=LYuLiSPsxXy HTTP/1.1 "
